{
  "as_of_time": "2026-05-01T00:00:00Z",
  "edge_count": 49,
  "edge_count_by_type": {
    "correlated_with": 4,
    "depends_on": 1,
    "evidence_for": 3,
    "exports_to": 1,
    "impacted_by": 6,
    "imports_from": 1,
    "located_in": 8,
    "participates_in": 6,
    "produces": 3,
    "requires": 8,
    "restricted_by": 4,
    "routes_through": 3,
    "supplies": 1
  },
  "edges": [
    {
      "attributes": {
        "as_of_time": "2026-05-01T00:00:00+00:00",
        "fixture_graph": true,
        "source_record_id": "sec-edgar-0000320193-2026-q1-risk-factor-lite"
      },
      "confidence": 0.72,
      "edge_id": "edge:company_apple:evidence_for:sec_supplier_concentration_disclosure",
      "edge_type": "evidence_for",
      "evidence_text_summary": "SEC EDGAR fixture metadata links Apple to a supplier concentration risk disclosure.",
      "provenance_refs": [
        {
          "as_of_time": "2026-05-01T00:00:00Z",
          "payload_hash": "52bf61feb6cb26fc2836af39a84cf3040a93aa31da6e36b5e5df7277ca6842ab",
          "provenance_url": "https://www.sec.gov/Archives/edgar/data/320193/000032019326000010/",
          "raw_id": "raw:sec_edgar:sec-edgar-0000320193-2026-q1-risk-factor-lite:52bf61feb6cb26fc",
          "retrieved_at": "2026-05-01T00:00:00Z",
          "source_id": "sec_edgar",
          "source_record_id": "sec-edgar-0000320193-2026-q1-risk-factor-lite"
        }
      ],
      "source_node_id": "company:apple",
      "target_node_id": "risk_event:sec_edgar_apple_supplier_concentration_2026_q1",
      "valid_from": "2026-01-30T00:00:00Z",
      "valid_to": null,
      "weight": 0.35
    },
    {
      "attributes": {
        "as_of_time": "2026-05-01T00:00:00+00:00",
        "fixture_graph": true,
        "source_record_id": "eto-semiconductor-network-2026-05"
      },
      "confidence": 0.92,
      "edge_id": "edge:applied_materials:located_in:us",
      "edge_type": "located_in",
      "evidence_text_summary": "Applied Materials is associated with the United States in the fixture source.",
      "provenance_refs": [
        {
          "as_of_time": "2026-05-01T00:00:00Z",
          "payload_hash": "6a70c2badffddfab2067748e2dfed8e45a259d0729b49162b26b638b98c6f827",
          "provenance_url": "https://eto.tech/dataset-docs/chipexplorer/",
          "raw_id": "raw:eto_cset_advanced_semiconductor_supply_chain:eto-semiconductor-network-2026-05:6a70c2badffddfab",
          "retrieved_at": "2026-05-01T00:00:00Z",
          "source_id": "eto_cset_advanced_semiconductor_supply_chain",
          "source_record_id": "eto-semiconductor-network-2026-05"
        }
      ],
      "source_node_id": "company:applied_materials",
      "target_node_id": "country:us",
      "valid_from": "2026-04-20T00:00:00Z",
      "valid_to": null,
      "weight": 1.0
    },
    {
      "attributes": {
        "as_of_time": "2026-05-01T00:00:00+00:00",
        "fixture_graph": true,
        "source_record_id": "eto-semiconductor-network-2026-05"
      },
      "confidence": 0.74,
      "edge_id": "edge:applied_materials:supplies:wafer_fab",
      "edge_type": "participates_in",
      "evidence_text_summary": "Applied Materials participates in wafer fabrication equipment ecosystems.",
      "provenance_refs": [
        {
          "as_of_time": "2026-05-01T00:00:00Z",
          "payload_hash": "6a70c2badffddfab2067748e2dfed8e45a259d0729b49162b26b638b98c6f827",
          "provenance_url": "https://eto.tech/dataset-docs/chipexplorer/",
          "raw_id": "raw:eto_cset_advanced_semiconductor_supply_chain:eto-semiconductor-network-2026-05:6a70c2badffddfab",
          "retrieved_at": "2026-05-01T00:00:00Z",
          "source_id": "eto_cset_advanced_semiconductor_supply_chain",
          "source_record_id": "eto-semiconductor-network-2026-05"
        }
      ],
      "source_node_id": "company:applied_materials",
      "target_node_id": "process_stage:wafer_fabrication",
      "valid_from": "2026-04-20T00:00:00Z",
      "valid_to": null,
      "weight": 0.65
    },
    {
      "attributes": {
        "as_of_time": "2026-05-01T00:00:00+00:00",
        "fixture_graph": true,
        "source_record_id": "eto-semiconductor-network-2026-05"
      },
      "confidence": 0.94,
      "edge_id": "edge:asml:located_in:nl",
      "edge_type": "located_in",
      "evidence_text_summary": "ASML is associated with the Netherlands in the fixture source.",
      "provenance_refs": [
        {
          "as_of_time": "2026-05-01T00:00:00Z",
          "payload_hash": "6a70c2badffddfab2067748e2dfed8e45a259d0729b49162b26b638b98c6f827",
          "provenance_url": "https://eto.tech/dataset-docs/chipexplorer/",
          "raw_id": "raw:eto_cset_advanced_semiconductor_supply_chain:eto-semiconductor-network-2026-05:6a70c2badffddfab",
          "retrieved_at": "2026-05-01T00:00:00Z",
          "source_id": "eto_cset_advanced_semiconductor_supply_chain",
          "source_record_id": "eto-semiconductor-network-2026-05"
        }
      ],
      "source_node_id": "company:asml",
      "target_node_id": "country:nl",
      "valid_from": "2026-04-20T00:00:00Z",
      "valid_to": null,
      "weight": 1.0
    },
    {
      "attributes": {
        "as_of_time": "2026-05-01T00:00:00+00:00",
        "fixture_graph": true,
        "source_record_id": "eto-semiconductor-network-2026-05"
      },
      "confidence": 0.88,
      "edge_id": "edge:asml:supplies:euv_scanner",
      "edge_type": "supplies",
      "evidence_text_summary": "ASML supplies EUV scanner equipment in the fixture.",
      "provenance_refs": [
        {
          "as_of_time": "2026-05-01T00:00:00Z",
          "payload_hash": "6a70c2badffddfab2067748e2dfed8e45a259d0729b49162b26b638b98c6f827",
          "provenance_url": "https://eto.tech/dataset-docs/chipexplorer/",
          "raw_id": "raw:eto_cset_advanced_semiconductor_supply_chain:eto-semiconductor-network-2026-05:6a70c2badffddfab",
          "retrieved_at": "2026-05-01T00:00:00Z",
          "source_id": "eto_cset_advanced_semiconductor_supply_chain",
          "source_record_id": "eto-semiconductor-network-2026-05"
        }
      ],
      "source_node_id": "company:asml",
      "target_node_id": "equipment:euv_scanner",
      "valid_from": "2026-04-20T00:00:00Z",
      "valid_to": null,
      "weight": 0.95
    },
    {
      "attributes": {
        "as_of_time": "2026-05-01T00:00:00+00:00",
        "fixture_graph": true,
        "source_record_id": "eto-semiconductor-network-2026-05"
      },
      "confidence": 0.93,
      "edge_id": "edge:intel:located_in:us",
      "edge_type": "located_in",
      "evidence_text_summary": "Intel is associated with the United States in the fixture source.",
      "provenance_refs": [
        {
          "as_of_time": "2026-05-01T00:00:00Z",
          "payload_hash": "6a70c2badffddfab2067748e2dfed8e45a259d0729b49162b26b638b98c6f827",
          "provenance_url": "https://eto.tech/dataset-docs/chipexplorer/",
          "raw_id": "raw:eto_cset_advanced_semiconductor_supply_chain:eto-semiconductor-network-2026-05:6a70c2badffddfab",
          "retrieved_at": "2026-05-01T00:00:00Z",
          "source_id": "eto_cset_advanced_semiconductor_supply_chain",
          "source_record_id": "eto-semiconductor-network-2026-05"
        }
      ],
      "source_node_id": "company:intel",
      "target_node_id": "country:us",
      "valid_from": "2026-04-20T00:00:00Z",
      "valid_to": null,
      "weight": 1.0
    },
    {
      "attributes": {
        "as_of_time": "2026-05-01T00:00:00+00:00",
        "fixture_graph": true,
        "source_record_id": "eto-semiconductor-network-2026-05"
      },
      "confidence": 0.82,
      "edge_id": "edge:intel:participates_in:wafer_fabrication",
      "edge_type": "participates_in",
      "evidence_text_summary": "Intel participates in wafer fabrication in the fixture source.",
      "provenance_refs": [
        {
          "as_of_time": "2026-05-01T00:00:00Z",
          "payload_hash": "6a70c2badffddfab2067748e2dfed8e45a259d0729b49162b26b638b98c6f827",
          "provenance_url": "https://eto.tech/dataset-docs/chipexplorer/",
          "raw_id": "raw:eto_cset_advanced_semiconductor_supply_chain:eto-semiconductor-network-2026-05:6a70c2badffddfab",
          "retrieved_at": "2026-05-01T00:00:00Z",
          "source_id": "eto_cset_advanced_semiconductor_supply_chain",
          "source_record_id": "eto-semiconductor-network-2026-05"
        }
      ],
      "source_node_id": "company:intel",
      "target_node_id": "process_stage:wafer_fabrication",
      "valid_from": "2026-04-20T00:00:00Z",
      "valid_to": null,
      "weight": 0.82
    },
    {
      "attributes": {
        "as_of_time": "2026-05-01T00:00:00+00:00",
        "fixture_graph": true,
        "source_record_id": "eto-semiconductor-network-2026-05"
      },
      "confidence": 0.78,
      "edge_id": "edge:intel:produces:advanced_logic",
      "edge_type": "produces",
      "evidence_text_summary": "Intel produces advanced logic in the fixture source.",
      "provenance_refs": [
        {
          "as_of_time": "2026-05-01T00:00:00Z",
          "payload_hash": "6a70c2badffddfab2067748e2dfed8e45a259d0729b49162b26b638b98c6f827",
          "provenance_url": "https://eto.tech/dataset-docs/chipexplorer/",
          "raw_id": "raw:eto_cset_advanced_semiconductor_supply_chain:eto-semiconductor-network-2026-05:6a70c2badffddfab",
          "retrieved_at": "2026-05-01T00:00:00Z",
          "source_id": "eto_cset_advanced_semiconductor_supply_chain",
          "source_record_id": "eto-semiconductor-network-2026-05"
        }
      ],
      "source_node_id": "company:intel",
      "target_node_id": "product_grade:advanced_logic",
      "valid_from": "2026-04-20T00:00:00Z",
      "valid_to": null,
      "weight": 0.7
    },
    {
      "attributes": {
        "as_of_time": "2026-05-01T00:00:00+00:00",
        "fixture_graph": true,
        "source_record_id": "eto-semiconductor-network-2026-05"
      },